{
  "schema_version": "cntryl-stress.v2",
  "tool_version": "0.4.0",
  "suite": "fixture",
  "run_profile": "default",
  "environment": {
    "cpu_model": "Apple M5",
    "core_count": 10,
    "os": "macos aarch64",
    "rustc_version": "rustc 1.98.1 (48a229cea 2026-09-01)",
    "allocator": "cntryl-stress allocator not installed",
    "build_profile": "debug",
    "git_commit": "0000000000000000000000000000000000000000",
    "tool_version": "0.4.0",
    "command_line": [
      "target/debug/examples/write_baseline"
    ],
    "profile_config": {
      "profile": "default",
      "measured_samples": 7,
      "warmup_samples": 0,
      "cooldown_samples": 0,
      "min_quality": "noisy",
      "fail_on_quality": false,
      "fail_on_regression": false,
      "regression_threshold": 0.05,
      "sample_duration": 500000000,
      "operations_per_sample": 1,
      "micro_sample_duration": 25000000,
      "report_depth": "default",
      "console_names": "compact",
      "progress": true
    }
  },
  "benchmark_specs": [
    {
      "id": "fixture/throughput/work",
      "name": "work",
      "tier": 2,
      "mode": {
        "type": "fixed_operations",
        "operations_per_sample": 1
      },
      "intent": "external",
      "budgets": {},
      "parameters": {
        "measurement_mode": "fixed_ops"
      },
      "metadata": {}
    },
    {
      "id": "fixture/latency/requests",
      "name": "requests",
      "tier": 2,
      "mode": {
        "type": "fixed_operations",
        "operations_per_sample": 1
      },
      "intent": "external",
      "budgets": {},
      "parameters": {
        "measurement_mode": "fixed_ops"
      },
      "metadata": {
        "primary_metric": "latency"
      }
    }
  ],
  "samples": [
    {
      "benchmark_id": "fixture/throughput/work",
      "intent": "external",
      "sample_number": 0,
      "phase": "measured",
      "elapsed_ns": 1000000,
      "wall_clock_ns": 8541,
      "operations_attempted": 1000,
      "operations_completed": 1000,
      "throughput": 1000000.0,
      "latency_ns": [],
      "parameters": {},
      "counters": {
        "attempted": 1000,
        "completed": 1000,
        "failures": 0,
        "timeouts": 0,
        "duplicates": 0,
        "dropped": 0,
        "validation_errors": 0
      },
      "environment": {
        "cpu_model": "Apple M5",
        "core_count": 10,
        "os": "macos aarch64",
        "rustc_version": "rustc 1.98.1 (48a229cea 2026-09-01)",
        "allocator": "cntryl-stress allocator not installed",
        "build_profile": "debug",
        "git_commit": "0000000000000000000000000000000000000000",
        "tool_version": "0.4.0",
        "command_line": [
          "target/debug/examples/write_baseline"
        ],
        "profile_config": {
          "profile": "default",
          "measured_samples": 7,
          "warmup_samples": 0,
          "cooldown_samples": 0,
          "min_quality": "noisy",
          "fail_on_quality": false,
          "fail_on_regression": false,
          "regression_threshold": 0.05,
          "sample_duration": 500000000,
          "operations_per_sample": 1,
          "micro_sample_duration": 25000000,
          "report_depth": "default",
          "console_names": "compact",
          "progress": true
        }
      }
    },
    {
      "benchmark_id": "fixture/throughput/work",
      "intent": "external",
      "sample_number": 1,
      "phase": "measured",
      "elapsed_ns": 1037000,
      "wall_clock_ns": 250,
      "operations_attempted": 1000,
      "operations_completed": 1000,
      "throughput": 964320.1542912248,
      "latency_ns": [],
      "parameters": {},
      "counters": {
        "attempted": 1000,
        "completed": 1000,
        "failures": 0,
        "timeouts": 0,
        "duplicates": 0,
        "dropped": 0,
        "validation_errors": 0
      },
      "environment": {
        "cpu_model": "Apple M5",
        "core_count": 10,
        "os": "macos aarch64",
        "rustc_version": "rustc 1.98.1 (48a229cea 2026-09-01)",
        "allocator": "cntryl-stress allocator not installed",
        "build_profile": "debug",
        "git_commit": "0000000000000000000000000000000000000000",
        "tool_version": "0.4.0",
        "command_line": [
          "target/debug/examples/write_baseline"
        ],
        "profile_config": {
          "profile": "default",
          "measured_samples": 7,
          "warmup_samples": 0,
          "cooldown_samples": 0,
          "min_quality": "noisy",
          "fail_on_quality": false,
          "fail_on_regression": false,
          "regression_threshold": 0.05,
          "sample_duration": 500000000,
          "operations_per_sample": 1,
          "micro_sample_duration": 25000000,
          "report_depth": "default",
          "console_names": "compact",
          "progress": true
        }
      }
    },
    {
      "benchmark_id": "fixture/throughput/work",
      "intent": "external",
      "sample_number": 2,
      "phase": "measured",
      "elapsed_ns": 1074000,
      "wall_clock_ns": 167,
      "operations_attempted": 1000,
      "operations_completed": 1000,
      "throughput": 931098.6964618249,
      "latency_ns": [],
      "parameters": {},
      "counters": {
        "attempted": 1000,
        "completed": 1000,
        "failures": 0,
        "timeouts": 0,
        "duplicates": 0,
        "dropped": 0,
        "validation_errors": 0
      },
      "environment": {
        "cpu_model": "Apple M5",
        "core_count": 10,
        "os": "macos aarch64",
        "rustc_version": "rustc 1.98.1 (48a229cea 2026-09-01)",
        "allocator": "cntryl-stress allocator not installed",
        "build_profile": "debug",
        "git_commit": "0000000000000000000000000000000000000000",
        "tool_version": "0.4.0",
        "command_line": [
          "target/debug/examples/write_baseline"
        ],
        "profile_config": {
          "profile": "default",
          "measured_samples": 7,
          "warmup_samples": 0,
          "cooldown_samples": 0,
          "min_quality": "noisy",
          "fail_on_quality": false,
          "fail_on_regression": false,
          "regression_threshold": 0.05,
          "sample_duration": 500000000,
          "operations_per_sample": 1,
          "micro_sample_duration": 25000000,
          "report_depth": "default",
          "console_names": "compact",
          "progress": true
        }
      }
    },
    {
      "benchmark_id": "fixture/throughput/work",
      "intent": "external",
      "sample_number": 3,
      "phase": "measured",
      "elapsed_ns": 1010000,
      "wall_clock_ns": 166,
      "operations_attempted": 1000,
      "operations_completed": 1000,
      "throughput": 990099.0099009901,
      "latency_ns": [],
      "parameters": {},
      "counters": {
        "attempted": 1000,
        "completed": 1000,
        "failures": 0,
        "timeouts": 0,
        "duplicates": 0,
        "dropped": 0,
        "validation_errors": 0
      },
      "environment": {
        "cpu_model": "Apple M5",
        "core_count": 10,
        "os": "macos aarch64",
        "rustc_version": "rustc 1.98.1 (48a229cea 2026-09-01)",
        "allocator": "cntryl-stress allocator not installed",
        "build_profile": "debug",
        "git_commit": "0000000000000000000000000000000000000000",
        "tool_version": "0.4.0",
        "command_line": [
          "target/debug/examples/write_baseline"
        ],
        "profile_config": {
          "profile": "default",
          "measured_samples": 7,
          "warmup_samples": 0,
          "cooldown_samples": 0,
          "min_quality": "noisy",
          "fail_on_quality": false,
          "fail_on_regression": false,
          "regression_threshold": 0.05,
          "sample_duration": 500000000,
          "operations_per_sample": 1,
          "micro_sample_duration": 25000000,
          "report_depth": "default",
          "console_names": "compact",
          "progress": true
        }
      }
    },
    {
      "benchmark_id": "fixture/throughput/work",
      "intent": "external",
      "sample_number": 4,
      "phase": "measured",
      "elapsed_ns": 1047000,
      "wall_clock_ns": 125,
      "operations_attempted": 1000,
      "operations_completed": 1000,
      "throughput": 955109.8376313277,
      "latency_ns": [],
      "parameters": {},
      "counters": {
        "attempted": 1000,
        "completed": 1000,
        "failures": 0,
        "timeouts": 0,
        "duplicates": 0,
        "dropped": 0,
        "validation_errors": 0
      },
      "environment": {
        "cpu_model": "Apple M5",
        "core_count": 10,
        "os": "macos aarch64",
        "rustc_version": "rustc 1.98.1 (48a229cea 2026-09-01)",
        "allocator": "cntryl-stress allocator not installed",
        "build_profile": "debug",
        "git_commit": "0000000000000000000000000000000000000000",
        "tool_version": "0.4.0",
        "command_line": [
          "target/debug/examples/write_baseline"
        ],
        "profile_config": {
          "profile": "default",
          "measured_samples": 7,
          "warmup_samples": 0,
          "cooldown_samples": 0,
          "min_quality": "noisy",
          "fail_on_quality": false,
          "fail_on_regression": false,
          "regression_threshold": 0.05,
          "sample_duration": 500000000,
          "operations_per_sample": 1,
          "micro_sample_duration": 25000000,
          "report_depth": "default",
          "console_names": "compact",
          "progress": true
        }
      }
    },
    {
      "benchmark_id": "fixture/throughput/work",
      "intent": "external",
      "sample_number": 5,
      "phase": "measured",
      "elapsed_ns": 1084000,
      "wall_clock_ns": 2000,
      "operations_attempted": 1000,
      "operations_completed": 1000,
      "throughput": 922509.225092251,
      "latency_ns": [],
      "parameters": {},
      "counters": {